{
  "annotations": [
    {
      "author": "D. Castilho",
      "color": "#c1121f",
      "contents": "Pending: signature page missing",
      "created": "2026-09-16T18:05:00Z",
      "flags": [
        "print",
        "locked"
      ],
      "font": {
        "family": "Nimbus Sans",
        "italic": false,
        "resolved": "Helvetica",
        "size": 11,
        "weight": "bold"
      },
      "icon": "Note",
      "id": "aaaa2222bb",
      "open": true,
      "page": 0,
      "rect": [
        504,
        720,
        540,
        756
      ],
      "thickness": 1,
      "type": "text_note"
    },
    {
      "accessibility": {
        "label": "Highlight on page 2, clause 4.2: interest restated"
      },
      "anchor": {
        "page_label": "2",
        "prefix": "the parties agree that",
        "quote": "interest shall continue to accrue at the contract rate",
        "score": 0.972,
        "state": "anchored",
        "suffix": "until the obligation is satisfied",
        "text_sha256": "3d5a4a3f0c1e2b6d7a8091a2b3c4d5e6f708192a3b4c5d6e7f8091a2b3c4d5e6"
      },
      "author": "D. Castilho",
      "color": "#1d3557",
      "contents": "Cross-check against clause 6.1: the rate here is the old one.",
      "created": "2026-09-16T18:00:00Z",
      "highlight_color": "#f4d03f",
      "id": "abc2d3e4f5",
      "modified": "2026-09-16T18:12:04Z",
      "opacity": 0.4,
      "page": 1,
      "provenance": {
        "imported_from": "sidecar",
        "lossy": false
      },
      "quads": [
        [
          72,
          712.5,
          300,
          712.5,
          72,
          700,
          300,
          700
        ],
        [
          72,
          690.5,
          288,
          690.5,
          72,
          678,
          288,
          678
        ]
      ],
      "rect": [
        72,
        678,
        300,
        712.5
      ],
      "replies": [
        {
          "author": "M. SAles",
          "created": "2026-09-16T18:20:31Z",
          "id": "m3n4p5q6r7",
          "in_reply_to": "abc2d3e4f5",
          "text": "Clause 6.1 was amended in August; keep this as is."
        }
      ],
      "rotation_at_capture": 0,
      "type": "highlight"
    }
  ],
  "document": {
    "filename": "contrato-assinado.pdf",
    "page_size": [
      [
        595.28,
        841.89
      ],
      [
        595.28,
        841.89
      ],
      [
        595.28,
        841.89
      ],
      [
        595.28,
        841.89
      ]
    ],
    "pages": 4,
    "projection": {
      "digest": "9f2c1a0b3e5d7091a2b3c4d5e6f708192a3b4c5d6e7f8091a2b3c4d5e6f70819",
      "written_at": "2026-09-16T18:13:00Z"
    },
    "sha256": "5b1c2d3e4f5061728394a5b6c7d8e9f0a1b2c3d4e5f60718293a4b5c6d7e8f90"
  },
  "format_version": 1,
  "generator": {
    "name": "tynypdf",
    "version": "0.1.0"
  },
  "settings": {
    "author_default": "D. Castilho",
    "flatten_on_export": false
  }
}
